SKU,Nombre
2271,CAPACITOR DE TRABAJO CUAD. 6MDF CON CABLES
1744,ABRAZADERA TUBO 1-1/4
FC108,ATOMIZADOR DE GATILLO 1LT
SV1465-B62002RS,BALERO 6200 2RS NTN
SV1465-B6082RS,BALERO NTN 608
6203'2RS 1-2[ C3,BALERO PFI 6203 1/2
7501206675267,BROCA-SIERRA BIMETALICA 2
7501206696545,CAPUCHON P/CABLE 10-12 A
7501206696552,CAPUCHONES P/CABLE 12-14 N
833650307,CINTA AISLANTE E-8000
2130,CONECTOR RAPIDO 5/16 - 5/16
7501206652602,CONECTOR RAPIDO GRIFO-MANGUERA
2129,CONECTOR REDUCCION 1/4 - 5/16 RECTO
7.5062406806E+12,DESARMADOR CRUZ 1/4 X 12 PRETUL
BS45,DISCO SEGMENTADO 4.5 BRONCE
2242,DOBLADOR DE TUBOS 180° 3/16-3/8 GB
2184,"FUSIBLE 1A, 220V"
7501390533015,GRASA PREMIUM MULTIPROPOSITO DUXCA-4 ROSHFRANS
SLIT35032,HIDROLAVADORA A PRESION PORTATIL
2135,KIT FILTROS OSMOSIS PURIKOR 6 ETAPAS 1 AÑO
7501206654736,MALETA 18 PORTAHERRAMIENTA TRUPER
XAMR16241,MULTIMETRO DIGITAL PROFESIONAL NT DT9205A AC-DC
7501310011067,PEGAMENTO EPOXICO X-TREME TOP
7503053083295,PROTECTOR CORTA VOLTAJE 3MIN. 220V COLDTEK
1499,SOLDADURA DE ESTAÑO 1 M ELECTRONICA
7506240650607,SOLDADURA ESTAÑO TRUPER BAJA PRESION
037103576040,TERMOMETRO DIGITAL HIGROMETRO-ALARMA GB
2437,TORNILLO PUNTA DE BROCA 1-1/2 SUELTO
2436,TORNILLO PUNTA DE BROCA 1-1/4 SUELTO
2302,VALVULA ESFERA ROSCABLE AZUL DE 1/2
79567520115,WD-40 382 ML
1860,BISAGRA PARA CUARTO FRIO CON MECANISMO AJUSTABLE A PAÑO 250MMX138MM MOD YL-1460
2799,BOMBA DE CONDENSADO 220V ASURITY 22´
2798,BOMBA DE CONDENSADO EXTERIOR 120V 22´ ASURITY
303,BOMBA P/COOLER MODELO B-70
302,BOMBA P/COOLER MODELO B-72
258,CABLE SEÑAL 3X14AWG 4 MTS.
246,CABLE SEÑAL 4MTS. 4X14AWG
DAR400,CAPACITOR DE ARR. 108-130 MDF 110V
951,CAPACITOR DE ARR. 189-227MDF. 110V
1495,CAPACITOR DE ARRANQUE 145-175 UF A 110 VAC
2274,CAPACITOR DE ARRANQUE 161-193 UF 110V
950,CAPACITOR DE ARRANQUE 243-292UF 125V
7503026178850,CONTACTOR 2 POLOS 40-50A 24V
2,CORTA TUBO 4-28MM
7503037201660,CUBIERTA TRANSPARENTE PARA MINI-SPLIT 130CM COLDTEK
7503037201677,CUBIERTA TRANSPARENTE PARA MINI-SPLIT 180CM COLDTEK
1916,EXPANSOR DE TUBO 1/4-3/4 ALTA CALIDAD
7503026414583,GUARDA TERMOSTATO M BTG-RK
7503026414590,GUARDA TERMOSTATO MODELO BTG-K
2202,JUEGO FLARE EN CAJA WK-806AM-L
7503028596041,KIT DE INSTALACION ALUMINIO 1/4-1/2
183,KIT INSTALACION ALUMINIO 1/4-3/8
234,KIT INSTALACION MS 1/4-5/8 COBRE
291,KIT INSTALACION P/MS 1/4-5/8 ALUM
292,KIT INSTALACION PARA MINISPLIT 3/8-5/8
Y5S413C0105L,MOTOR EVAP. MINISPLIT Y5S413C0105L
PEINE001,PEINE PARA ENDEREZAR SERPENTINES
06259817495880,PROTECTOR DE VOLTAJE MINISPLIT 220V-20A 35000BTU
192,RELAY P/TARJETA MS SFK-11DM
57,RETARDADOR DE TIEMPO 2S-10M.
APCB-213DA,TARJETA UNIV. PARA MINISPLIT APPLI PARTS APCB-213DA
7503026196878,TERMOSTATO PARA AIRE DE VENTANA 3 PINES 14-16.8
WG03F05627,TURBINA MINISPLIT MABE WG03F05627
687472053910,VALVULA DE EXPANSION 7/8-1 1/8 R22
1185,DIAFRAGMA BOILER DE PASO 12-13L UNIV.
1150,DIAFRAGMA BOILER DE PASO 5-6 LITROS
7506240658979,MANGUERA PARA BOILER 1/2 40CM
662013641108,"PILOTO TIPO T, 3 VIAS, 6CH24-6, 1830-490 ROBERTSHAW"
2216,REGULADOR DE GAS SENCILLO CON POOL R-3001-AS0
2215,REGULADOR DE GAS SENCILLO R-5000
1951-01,TERMOPILA 1951-01 C/ CONECTOR COAXIAL ROBERTSHAW
662013630997,VALVULA MILIVOLT 24VAC 700-056 ROBERTSHAW
2210,FILTRO CAMPANA MABE-IEM COMPLETO 26X36CM
W10587906,MODULO 6 SALIDAS WH ORG W10587906
WS01L18698,PERILLA ESTUFA MABE 295D4284G003 / WS01L18698
W10277026,PERILLA ESTUFA WH W10277026
WS01L16508,PERILLA PARILLA MABE WS01L16508
W10777489,VALVULA ESTUFA WHIRLPOOL SHUT-OFF DE CIERRE ORG. W10777489
1589,VÁLVULA QUEMADOR ESTUFA JUMBO MABE 6.5 CM WS01F03721
1591,VÁLVULA QUEMADOR ESTUFA MABE WS01F03720 223C4585P001
D10130577,GAS REFRIGERANTE 134 BOYA 13.6KG
D15170904,GAS REFRIGERANTE R 22 MINA 13.62KG
7503044381232,IMPULSOR GRIS DAEWOO 41 CM 11D DW-111/DWF-200
D10363114,REFRIGERANTE 410A 11.35 KG DUPONT
10000,BALERO NTN 6307 PARA LAVADORA FRONTAL
PRODUCTOEJEMPLO,PROD EJEMPLO
GLOBAL,VENTA PUBLICO GENERAL
W10006355,ACTUADOR NEGRO 7 PIN WH. ORG C/ ADAPTADOR
W11198451,ACTUADOR ROJO 7 TERM. WH. ORG W11198451
EAU64283201,ACTUADOR SELENOIDE LG. ORG. EAU64283201
W11091026,ACTUADOR TAPA WH ORG. W11091026
AGZ72909711,AGITADOR CROMADO LG KENMORE AGZ72909711
1456,AGITADOR DISCO LAV EASY MABE 18-19KG ORIGINAL 233D1974P001
W11550891,AGITADOR LAV. MAYTAG WHIRPOOL W11550891
W11564454,AGITADOR WH LAV. DIG. FLECHA CORTA W11564454 / W10531691
WP21002022,ANILLO FRICCION MAYTAG ORG
21002026E,ANILLO FRICCION MY GEN.
W10083200,ANILLO RETENSOR 1 1/8 WH CAND. BUJE BRON.
1290,"ARO TINA LAV, 10-11KG 189D1087P001"
1716,BANDA M-19.5 SAMSUNG GEN
WH1X2026,BANDA MOTOR LAV GE O.
WP21352320,BANDA MOTOR WHMY O.
1742,BANDA MULT-V6 EJ300 VSIMTY 189D3909P002
W10006384,BANDA PLANA WH ORG 5 COSTILLAS W10006384
LBFKEN642,BISAGRA PARA LAVADORA KENMORE WHIRLPOOL 8181642 | WP8181642
X003DV2SBN,BLOCAPUERTA ELECTROLUX 5304505231
W10547392,BLOCAPUERTA JAGUAR GRIS CON MICRO. WH OR. W10547392
6601EN1003D,BLOCAPUERTA LAV. LG 6601EN1003D
EBF61674802,BLOCAPUERTA LAV. LG EBF61674802 ORG.
DC64-00519D-E,BLOCAPUERTA LAV. SAMSUNG DC64-00519D GEN
W10443885,BLOCAPUERTA LAV. WH. FRONTAL W10443885 ORG.
X003XBS1ZP,BLOCAPUERTA MABE/GE WH08X32657
X002GA1719,"BLOCAPUERTA MAYTAG BRAVOS XL W10787836,W10619844"
1577,BLOCAPUERTA SAMSUNG GEN DC64-01538B
W11307244,BLOCAPUERTA WH CABRIO ORG W11307244
W10153867,BLOCAPUERTA WH ORG. DIG. W10153867
WP8183270,BLOCAPUERTA WH. ORG. WP8183270
W10253483,BLOCAPUERTA WHO W10253483
W11176112,BLOCAPUERTA WHO W11176112
W10324651,BLOCK TINA C/SUJETADOR Y TCA KIT DIGITAL W10324651
3363394V,BOMBA DE AGUA ENS. WH AC. ORG.
W10251309,BOTON INICIO WH DIG ORG. GRIS
W10647949,CANDADO SOPORTE TINA WH DIG. ORG.
W10759993,CLUTCH ENS. WH KIT POLEA CHICA W10759993
W910010062,CLUTCH ENS. WH KIT W910010062
W910010088,COPLE MOTOR REFORZADO WH ORG
DC97-17004E,CRUCETA PARA LAVADORA SAMSUNG FRONTAL DC97-17004E
1057,ELECTROVALVULA 180° MABE KR ORG. SENCILLA
W10894041,ELECTROVALVULA 2 ENTR. 3 BOBINAS WH ORG. W10894041
W11179275,ELECTROVALVULA BCA. 1 ENTRADA 1 SAL. WH ORG. W11161682
WW01F01651,ELECTROVALVULA CUADRUPLE MABE KR ORG.
W11165546,ELECTROVALVULA CUADRUPLE WH W11165546
AJU75152601,ELECTROVALVULA LAV. LG 5 BOBINAS. AJU75152601 ORG.
W10683653,ELECTROVALVULA ROCIADOR RECTO WHO W10683653
W910010004,ELECTROVALVULA ROCIADOR WH ORG. AZUL ROJA RELOJ W910010004
1381,ELECTROVALVULA SAMSUNG 1 ENTRADA 3 SALIDAS AZUL AGUA FRIA DC62-00266G
1758,ELECTROVALVULA SAMSUNG 2 ENT. 3 SAL. DC62-00266F
W10435242,ELECTROVALVULA WH CUADRUPLE W10435242
W11177741,EMPAQUE INTERIOR LAVAVAJILLAS W11177741
W10435302,FLECHA CUBIERTA WH CAB. OR.
FOLAMB004,FONDO CANASTA AMAZ. 189D3533P001
189D5393P001,FONDO CANASTA MABE AQUA SAVER 189D5393P001
2047,FONDO CANASTA SAMSUNG DC60-00101A
MDS63916504,FUELLE LAV LG FRONTAL MDS63916504
W10290499,FUELLE LAV. FRONTAL WH ORG. W10290499
W11106747,FUELLE LAV. FRONTAL WH. W11106747
W11314648,FUELLE LAV. FRONTAL WHIRPOOL W11314648
2025,FUELLE LAV.SAMSUNG DC97-18094B GEN
4986ER0004F,FUELLE PUERTA LAV. FRONTAL LG ORG. 4986ER0004F
WP3390719,FUSIBLE CORTO WHO WP3390719
1543,IMPULSOR AZUL SAMSUNG 40CM 11D DC-66-00694A
2203,IMPULSOR AZUL SAMSUNG 43CM DC66-00704A
1988,IMPULSOR DAEWOO 41CM 11 DIENTES DWF-M610
W10734521,KIT EMBRAGUE WH DIGITAL W10734521
388253A,KIT NEUTRAL WHO
1373,LBS - ELECTROVALVULA SAMSUNG 2 BOBINAS DC6200311D
W910010082,LINING CLUTCH WH OR 285790
W10096921,MANGUERA DESAGUE SOLA WH ORG. W10096921
W10358149,MANGUERA INTERNA DRENADO WH ORG. W10358149
WP8182634,MICROSWITCH WH. DUET WP8182634
1997,MOTOR BOMBA LAV LG 2 BOCAS TIPO BPX-2
W10465543,MOTOR BOMBA WH COMPLETA ORG
1915,MOTOR BOMBA WH FRONTAL COMPLETA BPX401-75
W10677715,MOTOR LAV. 1/4HP WH DIG. ORG. W10677715
X003YRFGZV,NARIZ ACTUADOR ELECTROLUX 5304505088
358684V,NARIZ ACTUADOR WH
W10239968,NARIZ ACTUADOR WH DIG
W10001130,PATA NIVELADORA TORNILLO WHO
WP8538957,PERILLA DE CONTROL GRIS/PLATA ORG CHICA
W10743994,PERILLA LAV SEC WH ORG. DIG
203,POLEA CON PIÑON MY
WH07X10016,POLEA LAV. GE CARGA FRONTAL GDE. WH07X10016
WW01F00357,POLEA MOTOR MB AMAZ. MAGN.
WW01F00043,POLEA TRANSMISION MB AM ORG.
W10820043VP,POSTE ENSAMBLE WH COMP. OR.
W10339251,PRESOSTATO 4 NIVELES WHO W10339251
2284,PRESOSTATO LAV. SAMSUNG DC96-01016A GEN.
W11160690,PRESOSTATO LAV. WH. W11160690 ORG.
W10337781,PRESOTATO WH W10337781
W10380698,PROPELA AGITADOR OASIS W10380698
W10844636,RELOJ DESHIELO WH 8HRS ORG
1467,RELOJ MECANICO LAV 20 MIN MEDIA CAÑA 2 TERMINALES UNIVERSAL
40801,"RESISTENCIA BLINDADA REF. LG,SM,LG 52 CMS 60128-0023300-00"
W11104317,RESORTE EMBRAGUE WHO W11104317
W10250667,RESORTE TRASERO WH ORG
607,RESPALDO PIÑON SIRVE MBOL
1452,SELECTOR MBK 18-22KG 4 SELECTORES WW01F01794
DW1707,SELENOIDE ACTUADOR NEGRO SAMSUNG DAEWOO ORG. DW1707
356427V,SELLO INFERIOR SP WH ORG. PLANO
A4298,SELLO POSTE LAV. MAYTAG ORG A4298
W10219156,SELLO TINA JGO. MAYTAG MODERNO
2139,SELLO TINA LAV FRONTAL LG/SAMSUNG DC62-00156A
2296,SELLO TINA LAV FRONTAL SAMSUNG DC62-00223A GEN
WW02F00547,SELLO TINA MBAM ORG.
2282,SELLO TINA MY ANTIGUO GEN. 6-2095720
6-2095720,SELLO TINA MY ANTIGUO ORG. 6-2095720
W10006371,SELLO TINA WH DIG ORG.
EBD48922821,SENSOR DE VIBRACION LG ORG. EBD48922821
1427,SENSOR HALL MOTOR SAMSUNG DC31-00076A-E
1996,SENSOR HALL MOTOR SAMSUNG DC31-00098A
DC97-21487D,SENSOR HALL SAMSUNG DC97-21487D ORG.
1123,SENSOR LAVASECADORA SAMSUNG DC93-00329A
W910010096,SOPORTE SUSP. KIT 3 WHO
W10780051,SUSPENCION 59CM VERDE WH ORG. W10780051 W910020084
W10010044,SUSPENCION 60 CM WHO NEGRA
W910010083,SUSPENCION 65CM AMARILLA WH ORG.
WW01F00370,SUSPENCION LAV MB 370 AZUL
W10780046,SUSPENSION 60 CM. KIT 4 SET. W10780046 WH ORG
W10820048,SUSPENSION AZUL 67CM WH ORG. RESORTE LARGO KIT 4 W10820048
DW1715,SUSPENSION DAEWOO 61.5CM ORG. AZUL-BLANCO
WW01F00369,SUSPENSION LAV MABE 360 68CM VERDE
981,SUSPENSION LAV SAMSUNG/DAEWOO DC97-16350 64CM
W11084453,SUSPENSION WH ORG. ROSA 59 CM 4P W11084453
W910010086,SUSPENSION WH VERDE 59.5 W910010086
W11217817,SUSPENSION WHO 66CM W11217817
1785,SWITCH BLOQUEAPUERTA SAMSUNG DC34-00025B GEN
W11025892,SWITCH DE BALANCE WH OR W11025892
DW1704,SWITCH DE TAPA LAVADORA DAEWOO ORIGINAL C/PALANCA
X003XETJIZ,SWITCH PUERTA LAV SAMS DC34-00025D
EBF49827801,SWITCH PUERTA LG FRONTAL EBF49827801 ORG
W11195059,SWITCH SELECTOR WH ORG W11195059
134101800E,SWITCH TAPA LAV WW C/PALANCA GEN
W11302950,SWITCH TAPA WH ORG NEGRO NUEVO LARGO W11543567
X0048WZZ7Z,SWITCH. PUERTA LAVAPLATOS GE. WD21X10490
W11377430,TARJETA BATMAN ACU W11385756/W11377430
W10781579,TARJETA CONTROL AUXILIAR LAV. WH. ORG. W10781579
W11201274,TARJETA CONTROL LAV. WHIRPOOL W11201274
233D2306G002,TARJETA CONTROL MABE CENTRO LAVADO MOD: MCL2040 233D2306G002
W10788354,TARJETA CONTROL PRINC. W10788354 WH ORG
W11179245,TARJETA CONTROL PRINC. W11179245 WH ORG.
W11518672,TARJETA CONTROL PRINC. W11518672 WH ORG
W11518673,TARJETA CONTROL PRINC. W11518673 WH ORG
W11518675,TARJETA CONTROL PRINC. W11518675 WH ORG
W11518677,TARJETA CONTROL PRINC. W11518677 WH ORG.
W11518678,TARJETA CONTROL PRINC. W11518678 WH ORG
W11518679,TARJETA CONTROL PRINC. W11518679 WH ORG
W11518680,TARJETA CONTROL PRINC. W11518680 WH ORG
W11518682,TARJETA CONTROL PRINC. W11518682
W11518688,TARJETA CONTROL PRINC. W11518688 WH ORG
W11518690,TARJETA CONTROL PRINC. W1151890 WH ORG
1900,TARJETA CONTROL SIRUS360 REF MA-G
WW01F01800,TARJETA DE CONTROL MABE KRAKEN WW01F01800
2031,TARJETA LAV. SAMSUNG FRONTAL DC92-02547C / DC92-02551C/ DC
2030,TARJETA LAV. SAMSUNG INVERTER ORG. DC92-00388
DC92-0149B,TARJETA LAV. SAMSUNG PERILLA DC92-0149B
XRWW85517,TARJETA SELECTOR WH O W1196162
W10572831,TIMER 4 TERM. ACROS W10572831
W10185786,TIMER LAV. WH. ORG. W10185786
WP3949208,TIMER PARA LAVADORA WH. ORG. W3949208
WP3951702,TIMER RELOJ LAV. WH ORG. 3951702
W10450389,TINA COMPLETA WH FRONTAL W10450389
2201,TORNILLO AGITADOR LAV. MAYTAG
TRLAWH004,TRANSMICION CLUTCH LAV. WH
W10762611,TRANSMISION CON SOPORTE COPACABANA ORG. W10762611
W10715767,TRANSMISION FLECHA CORTA WH CON SENSOR W10715767
W11454741,TRANSMISION FLECHA LARGA WH. ORG.
2045,TRANSMISION LAV. SAMSUNG IVERTER DC97-717900A
2038,TRANSMISION LAV. SAMSUNG ORG. DC97-16984B
1757,TRANSMISIÓN LAVADORA MABE AMAZONAS TIPO VSIMTY 188D2871G001
170,TRANSMISION MB KR 16-17KG PLATO DELGADO 233D2549G006
171,TRANSMISION MB KR 18-22 PLATO GRANDE 233D2549G001
1115,TRANSMISION METALICA DAEWOO ORG. GM-1300
4265EY1003P,TRANSMSION LAV. LG 4265EY1003P POLEA PLANA
W10349492,TURBINA WHO WPW10349492
1828,DIAFRAGMA BONJOUR T-FAL
WP9704291,DIAFRAGMA CON EMPAQUE WH WP9704291
W10555711,VASO C/ DIAFRAGMA BASE REDONDA W10555711
2112,EMPAQUE SILICON NO.22 T-FAL/MAEFE
2113,EMPAQUE SILICON NO.24 T-FAL/MAGEFE
2114,EMPAQUE SILICON NO.26 T-FAL/MAGEFE
2115,EMPAQUE SILICON NO.28 T-FAL/MAGEFE
8033158041122,ADITIVO PARA ACIDEZ EN SISTEMAS A/C COOL-SHOT ULTRA
200D3719P001,ANAQUEL REF. MABE 200D3719P001
037103570192,ARRANCADOR 3N1 DE 1/4- 1/3 HP GB
WR01F00099,ASPA PLAST. BUJE 1/8 4
1082,ASPA TURBINA SAMSUNG ORG. DA31-00242
204,BIMETAL 60-32 MB
7503053083370,BIMETAL Y FUSIBLE SM. DA47-00243
WR01L13595,CAJON REF. VERDURAS MABE ORG. WR01L13595
2185,CAPACITOR DE ARRANQUE 100-125 UF. 110 V.
2186,CAPACITOR DE ARRANQUE 378-490 UF A 110 V.
1913,CELDA PELTIER REFRIGERACION TEC1-12706 12V 2A 60W
1275,CERRADOR AUTOMATICO PUERTA SAMSUNG ORG. DA97-13070A
NJ2212GK,"COMPRESOR 1 1/2, NJ2212GK 110V 60HZ R404"
105G5913,COMPRESOR DANFOSS 1/4 PESADO R134 105G5913
102G3432,COMPRESOR DANFOSS 1/6 R134
EMC3140U,COMPRESOR EMBRACO 1/2 INVERTER EMC3140U R290
513200759F16NLQ25,COMPRESOR EMBRACO 1/3 FFU100HAK
513200902FB8BJ2CX,COMPRESOR EMBRACO 1/4 FFU80HAX
NT6220GKV,COMPRESOR EMBRACO 3/4 115V R404 NT6220GKV
VEMX11C+,COMPRESOR EMBRACO INVERTER R600 VEMX11C+
N21Q33K687,COMPRESOR INVERTER LG ORG FMA102NBMA R600A
1C1X25621311-13K987,COMPRESOR LG INVERTER 220V 51HZ FLD165NBMA
FLE165NAMA,COMPRESOR LG INVERTER 220V 53HZ FLE165NAMA R600
1233,COMPRESOR LG ORG. INVERTER 240V 60-225HZ BMG110NHMV
NC1MV90ALP,COMPRESOR SAMSUNG INVERTER NC1MV90ALP 160-260V 500-200HZ
2299,COMPRESOR SAMSUNG INVERTER NI34T9101AB R600
105G5914,COMPRESOR SIKELAN 1/3 PESADO GQR11TD
XXXX,COMPRESOR USADO DIF CAP
1863,CONDENSADOR 1/4 - 1/5
ACG76304502,CONDENSADOR REF. LG ACG76304502
W10530058,CONTROL AMBIENTAL L60T WH
W10594330,CONTROL DAMPER TEMP. WH ORG. W10594330
2183,CONTROL DE TEMPERATURA W2809 12 VOLTS.
W10567140,CONTROL TEMPERATURA REF WHO W10567140
DA31-00043F,DAMPER REF. SAMSUNG DA31-00043F
@2722741@,DETECTOR DE FUGAS HALOGENO
WR01F01914,ELECTROVALVULA DOBLE 110V MABE 197D2638P006
1784,ELECTROVALVULA REF. SAMSUNG DA62-01477A
2089,ELECTROVALVULA REF. WH. K-75985
1446,ELECTROVALVULA SM ORG 12V PARA REFRIGERADOR DA62-04242A
2036,EVAPORADOR MODERNO SAMSUNG DA96-01230A
1991,EVAPORADOR SAMSUNG DA49-00554C
158,FILTRO AGUA LG KM CORTO LT 500P 46-9890 WF290
7503026414613,FILTRO AGUA REF SM DA29-00020B CT
152,FILTRO AGUA SM DA29-00020B
W10295370,FILTRO DE AGUA CORTO AZUL WH W10295370
WR01A01876,FILTRO DE AGUA GE CORTOMWF
XWFE,FILTRO DE AGUA MABE ORG. XWFE
UKF8001AXX-E,FILTRO DE AGUA MAYTAG-AMANA UKF8001AXX
7503026203521,FILTRO DE AGUA MAYTAG-AMANA UKF8001AXX GEN
1422,FILTRO DE AGUA REF SIRVE MAYTAG TIPO UKF-7003
W10790820,FILTRO DE AGUA REF WH ORG W10790820 / 4396510 N.5
012505468094,FILTRO DE AGUA REF. FRIGIDAIRE FPPWFU01 PWF-1
2165,FILTRO DE AGUA REF. MABE-GE LARGO RPWF-W
7503026203477,"FILTRO DE AGUA REF. SIRVE LG LT700P, SIRVE KENMORE 46-9690"
8808993705788,FILTRO DE AGUA SAMSUNG ORG. DA29-00020B
401,FILTRO DE AGUA SM DA29-00003G
1367,FILTRO REF SAMSUNG CUADRADO MODERNO DA97-17376B
W10809516,FOCO REF. WH ORG
RA0036,FOCO REFRIGERADOR DAEWOO 6 LEDS
W11466252,FUSIBLE DOBLE REF. WHIRPOOL W11466252 ORG.
AEQ32178402,ICEMAKER LG AEQ32178402
1079,ICEMAKER MODERNO SAMSUNG 30122-0049300
2098,ICEMAKER SAMSUNG BRAZO CORTO ORG. DA97-19010A
X0045C4SSZ,ICEMAKER SAMSUNG DA97-08059A
2048,ICEMAKER SAMSUNG ORG. DA97-21995A
W10873791,ICEMAKER WH W10873791
2197,JARRA REF. SAMSUNG DA97-17395A
2256,JUEGO DE MANOMETRO CON MANGUERAS R410-R134 Y BLISTER
W11350838,KIT RELAY REF. WH. ORG. W11350838
2034,LUZ LED LARGO SAMSUNG DA96-01119A
2013,MANOMETRO DIGITAL C/VACUMETRO PREMIUM GB C/MALETIN DG-350
037103573063,MANOMETRO DIGITAL MANOMETROS INDEPENDIENTES GB C/MALETIN DG-05
LG AEQ72910414,MAQUINA DE HIELO LG ORG. LG AEQ72910414
139,MIRILLA INDICADORA DE HUMEDAD SA-17S
1 30PL30,MODULO DE ENCENDIDO EMERSON
1 D188,MOTOR 1/20 FASCO 1500RPM 220V
1084,MOTOR CONDENSADOR GRIS SAMSUNG ORG. DA97-15765
SAMREF01,MOTOR CONDENSADOR SAMSUNG ORG. NEGRP Z19W12MS
W10236142,MOTOR CONDENSADOR WH ORG. BLANCO 115V W10236142
W10124096E,MOTOR CONDENSADOR WH ORG. W10124096
7503044381683,MOTOR ELECTRICO PARA REF. 110-240V ECM7112
1331,MOTOR EVAP SAMSUNG 12 12V 3.21W DA31-00146E 2520 RPM
2269,MOTOR EVAP. GRIS 2 CABLS ADL-5846 110V
197D2038P025,MOTOR EVAP. MABE ORG 115V 197D2038P025
SAMREF02,MOTOR EVAP. SAMS ARES2130RA
2090,MOTOR EVAP. SAMSUNG 13A 2.1W 12V DA31-00146H 2950RPM
W10271507,MOTOR ICEMAKER WH W10271507
1107,MOTOR LG ORG. AZUL 12V 1A ODM-001F-42
1108,MOTOR LG ORG. NARANJA ODM-001F-43
2294,MOTOR REF. SAMSUNG N.12 DA31-00146E 2620 RPM
2295,MOTOR REF. SAMSUNG N.13 DA31-00146H 2900 RPM GEN.
2010,MOTOR TIPO WELLINGTON 110-240V 15W CCW
WR60X10358,MOTOR VENT. CONDENSADOR REF. GENERAL ELECTRIC WR60X10358
WR60X26866E,"MOTOR VENTILADOR EVAP. GE 4 CABLES GEN WR60X26033, WR60X26866"
PUC38,NIPLE CONECTOR RAPIDO 3/8
PUC8MM,NIPLE CONECTOR RAPIDO 8 MM
WP2188656,PAR CAJONES REF WH WP2188656
105G5951,R134COMPRESOR DANFOSS 1/2 PESADO 1
GS0003,RELOJ DE DESHIELO LG 6H OR
10079046005406,RELOJ DE DESHIELO P/ CAMARA FRIGORIFICA 110V D81-8144-00EX
10079046005505,RELOJ DE DESHIELO P/ CAMARA FRIGORIFICA D81-8145-20EX 220 V
W10844633,RELOJ DE DESHIELO WH 8.21H ORG
2150,RESISTENCIA BLINDADA 31 CM. TIPO L 60128-0013800
2151,RESISTENCIA BLINDADA 38 CM. TIPO L 60128-0013900-01
2152,RESISTENCIA BLINDADA 41 CM. TIPO L 60128-0011302-01
2153,RESISTENCIA BLINDADA 45 CM. TIPO L 60128-0017600-00
1132,RESISTENCIA BLINDADA SAMSUNG ORG DA47-00244P
1781,RESISTENCIA GANCHO LARGA DA47-000460G
1098,RESISTENCIA ICEMAKER SAMSUNG DA-47-00192E
W11115796,RESISTENCIA REF WH W11115796
X002HC9REZ,"RESISTENCIA SIRVE GE, EDGEWATER DE1121C/WE1121C"
1761,RESISTENCIA TUBULAR REF 10-1/2 X 18-1/12 PULG W10647284 WH ORG
W10345817,RESISTENCIA TUBULAR WH 15-1/2 X 3-1/2 ORG. W10345817
2032,SENSOR AMBIENTAL AMARILLO SAMSUNG DA32-00070A
1055,SOLDADURA EN FRIO LA-CO
W10440786,SUSPENSION WH. 71CM ROSA W10440786 ORG
1131,SWITCH FOCO SEC. SAMSUNG ORG. DC64-00828B
W11396033,SWITCH P/FOCO REF. WH. ORG. W11396033
1487,SWITCH PUERTA REF. LG HC-056K
1484,SWITCH PUERTA REF. SAMSUNG SP201R-7D
6600JB2005C,SWITCH REF. LG ORG. 5 PINES 6600JB2005C
1766,SWITCH REF. SAMSUNG ORG DA34-00066B
162D6801G046,TANQUE ALMACENADOR DE AGUA REF MABE-GE ORG. 162D6801G046
CSP30020818,TARJETA CONTRO PRINC. LG ORG. INVERTER CSP30020818
WR01F00288,TARJETA CONTROL PRINCIPAL MBGE WR01F00288 / 225D4208G003
WR01F00242,"TARJETA CONTROL REF. MABE ORG. 225D3466G009,008 WR01F00242"
W11436572,TARJETA CONTROL REF. WH ORG. W11436572
W10503278,TARJETA CONTROL WH W10503278
W11410542,TARJETA CTRL. REF. MONARCA W11410542
CT225D4205G0071514,TARJETA DE CONTROL PRINC. MBGE 225D4205G003
DA92'0044A,TARJETA DESHIELO SM O. 9H
1179,TARJETA INVERTER REF. SAMSUNG DA92-00768J
1299,TARJETA INVERTER SAMSUNG ORG DA41-00411B
2080,TARJETA PODER SAMSUNG ORG. DA92-00795B
1554,"TARJETA POTENCIA PARA REF. 120V, 20A TREF-G03"
DA41-00388H,TARJETA REF. DA-4100388 SAMSUNG
6871JK1005,TARJETA REF. LG 5 FOCOS 6871JK1005
EBR30299302,TARJETA REF. LG ORG. EBR30299302
WR55X21623,TARJETA REF. MABE WR55X21623 ORG
W10257565,TERMISTOR SENSOR REF WH ORG. W10257565
2287,TERMISTOR SENSOR REF. SAMSUNG DA32-10104V
2227,TERMOMETRO DIGITAL CON ALARMA Y MEMORIA -50 A 70C
819,TERMOSTATO CALENTADOR DE AGUA 86° 110V
7503026414941,TERMOSTATO DIGITAL COLDTEK -50-70C
1497,TERMOSTATO PARA VITRINA STC-1000 C/SENSOR
1410,TERMOSTATO REF MABE 8-10 PIES ORG.
W10424991,TERMOSTATO REF. WHIRPOOL W10424991 ORG.
1104,TERMOSTATO SAMSUNG VERDE PFN-C71
2198202E,TERMOSTATO WH 2198202 GEN.
W10384183,TRANSISTOR SENSOR DE TEMPERATURA WH ORG. W10384183
W11575003,VALVULA 3 VIAS WH ORG. W11575003
W11590197,VALVULA 3 VIAS WH ORG. W11590197
1969,VALVULA CHECK RIGIDA ANGULADA 45°
1505,VALVULA PARA CARGAR GAS PINCHABLE 1/4-5/16
EAU62025701,VENTILADOR COND. LG. 3 CABLES EAU62025701
234D2071G001,ARO FRICCION SEC EASY KRAKEN ORG. 234D2071G001
WE12M29,BANDA MABE GE
1404,BANDA SAMSUNG ORG 117CM 5PISTAS 6602-001655
308D1415P003,BANDA SEC MABE 123CM 308D1415P003
W11162091,"BANDA SEC, WH. 124CM W11162091"
W10136934,BANDA SEC. 5H. WHO 120CM W10136934
WPY312959,BANDA WH 127CM ORG WPY312959
W10131172,BANDA WH ORG. 5 PISTAS 118CM W10131172
279834V,BOBINAS DE GAS SEC. WH O.
1226,CODO CAMPANA 3/8-3/8
2298,COMPRESOR MABE 1/5 SU96XY1 115-127V R600
5303937139P,DESLIZADOR Y FELPA FONTAL SUPERIOR TAMBOR ORG
DC97-07618A,FELPA SEC. SAMSUNG DC97-07618A
W11035878,FELPA SEC. WH FRONTAL W11035878
W10717210,FILTRO ATRAPA PELUZA WH ORG. W10717210
DC61-02595A,FILTRO ATRAPAPELUSA SAMSUNG DC61-02595A
W10859086,FILTRO SECADORA MAYTAG W10859086
WP31001556VP,IGNITOR BASE CHICA WHO
WPW10549553,JALADERA BLANCA PUERTA SEC. WH. W10549553
W10861225,JALADERA PUERTA SEC WH BLANCA W10861225
W11581316-S,JUEGO DE ESPREAS SEC. WH. COMPLETA GAS LP W11581316-S
W910010009,JUEGO DE ESPREAS WH OR.
WE25X218,KIT ESPREA NATURAL SEC. GE/MABE WE25X218
AGM30045804,"KIT SECADORA LG, TERMISTOR, TERMOSTATO AGM30045804"
DC31-00055H,MOTOR SEC. SAMSUNG DC31-00055H
76818380009,PEGAMENTO PÁRA FELPAS SEC.
W10743997,PERILLA CONTROL SEC. WH. ORG MEDIANA W10743997
W11611672,"PERILLA SELECTOR SEC, WH, W11611672"
W11291948,PERILLA TIMER SEC. WH. CROMO W11291948
1101,POLEA CON BRAZO SAMSUNG ORG. DC66-00903A
1912,POLEA TENSORA AMANA SEC. 38225-REPL WP40045001
WP691366,POLEA TENSORA COMPLETA WH ORG. 691366
W10837240,POLEA TENSORA COMPLETA WHO
1163,POLEA TENSORA WH ANCHA TIPO 6-3700340
X00243STSH,"RESISTENCIA SEC WH, ORG 3387747"
2160,RESISTENCIA SEC. SAMSUNG DC47-00019A
349241T,RODILLO TAMBOR PAR WHO 349241
2037,SOPORTE PUERTA SEC. SAMSUNG DC97-18057A
WE4M416,SWITCH ENCENDIDO MABE ORG WE4M416
W10169313,SWITCH PUERTA WH OR.
WP3398095,SWITCH WH 3398095
W11027185,TARJETA CTRL SEC. WH. ORG W11027185
1976,TERMICO SEC. WH GEN L155-25F 4TERM. 3387134 SECADORA ELECTRICA
3387134,TERMICO SEC. WHO L155-25F 4 TERM. 3387134
5304406099,TERMICO SECADORA WW L240-50F ORG.
X002V2NXLJ,"TERMISTOR DE TEMPERATURA LG ROJO 6323EL2001B, 6323EL2001H"
WP31001590,TERMISTOR WH WP31001590
338906V,TERMOSTATO SENSOR FLAMA I WH MAY O.
1632,TIMER SECADORA WH W10185969 / 701-1-AM1631
1631,TIMER SECADORA WH W10185992 / 602-1-AM
WPW10185992,TIMER SECADORA WH WPW10185992
WP694089,TURBINA MOTOR SEC. WHO WP694089
WP53'0106,TURBINA MYO
LOT400,VALVULA SEC MABE EASY-GE ORIGINAL GAS LP(BUTANO)
AGM30063309,VALVULA SEC. LG ORG. 5221EL2002A
189D7089P003,VALVULA SEC. MABE EASY GAS LP ORG. 189D7089P003
189D7089P016,VALVULA SEC. MABE ORG. BOBINA DUAL 189D7089P016
189D7089P001,VALVULA SEC. MABE ORIGINAL 2 BOBINAS NUEVA
212D1460P001,VALVULA SEC. MABE ORIGINAL 3 BOBINAS COMPLETA
LOT401,VALVULA SECADORA MABE ORIGINAL GAS LP
BN,BARRIDO NITROGENO PARA LIMPIEZA
BC11,BOMBA PARA COOLER DE 11000FT MAXCOOL 230V
CH14,CHUMACERA DE 1 1/4
CJPC,COJINES DE PAJA PARA COOLER DE 55X10
SC11,EVAPORADOR PARA REFRIGERADOR TIPO VITRINA DE COBRE
1734,EXTRACTOR VENTILADOR PARA BAÑO MARCA BROAN 4.0 CFM (PI3/MIN) INCLUYE INSTALACION
JDES,JUEGO DE EMPAQUES DE SUCCION Y DESCARGA
JGF,JUEGO DE FLOTADOR DE LLENADO DE SANITARIOS
LAVIS,PERILLA DE CONTROL DE TEMPERATURA PARA REFRIGERADOR MABE
LAVU,RESISTENCIA ELECTRICA 220V PARA SECADORA MARCA SAMSUNG
WR03F04507,TARJETA DE CONTROL PARA REFRIGERADOR MABE SIRUS 500
XAXA,VENTE
2243,TERMOSTATO DIGITAL VITRINA TREF-G01